"topic","subtopic","difficulty","question","correct_answer","wrong_answer1","wrong_answer2","explanation"
"Human Body","Respiratory System","Very Challenging","Why is carbon dioxide, not the lack of oxygen, the main trigger for breathing?","Special sensors in your brainstem detect rising carbon dioxide levels and trigger breathing to maintain balance.","Carbon dioxide makes your lungs itch, causing you to breathe to scratch them.","Oxygen is actually invisible to your body, so it can only detect carbon dioxide.","Your brainstem contains chemoreceptors that are highly sensitive to carbon dioxide levels in your blood but less sensitive to oxygen levels. As carbon dioxide builds up (a waste product from cells using energy), these sensors trigger the urge to breathe before oxygen levels drop too low. This system prioritizes removing waste over bringing in new oxygen - like taking out the trash before bringing in new groceries."
"Human Body","Respiratory System","Very Challenging","How do your lungs and blood work together to balance oxygen and carbon dioxide levels?","Red blood cells pick up oxygen and drop off carbon dioxide in the lungs, then do the opposite in body tissues.","Lungs directly pump oxygen into the bloodstream using tiny biological pumps.","Blood cells carry mini-lungs that do the breathing for your actual lungs.","Your red blood cells contain hemoglobin that changes shape when it encounters oxygen in the lungs, allowing it to pick up oxygen molecules. When these same cells reach body tissues where oxygen levels are low and carbon dioxide is high, the hemoglobin changes shape again, releasing oxygen and picking up carbon dioxide. This elegant exchange system ensures constant delivery of oxygen and removal of waste gas throughout your body."
"Human Body","Respiratory System","Very Challenging","Why can holding your breath make you feel dizzy?","Holding your breath increases carbon dioxide in your blood, which affects brain function and blood flow.","Your brain runs out of air directly since it uses the most oxygen.","Your lungs send panic signals to your brain that cause dizziness.","When you hold your breath, carbon dioxide begins to build up in your bloodstream. High CO₂ levels cause blood vessels in your brain to dilate, increasing blood flow but potentially causing lightheadedness. Additionally, changing CO₂ levels affect your brain's function directly. Your brain is very sensitive to these chemical changes - it's monitoring blood chemistry carefully and responds quickly when levels are outside the normal range."
"Human Body","Respiratory System","Very Challenging","How does your body adjust to high altitudes where there's less oxygen?","Your body produces more red blood cells, increases breathing rate, and adjusts how efficiently your tissues use oxygen.","Your lungs grow larger to capture more of the available oxygen.","Your blood turns into a different type that needs less oxygen.","At high altitudes where oxygen is scarce, your kidneys detect lower oxygen and release a hormone called erythropoietin that triggers increased red blood cell production. Your breathing rate also increases, and your body becomes more efficient at extracting and using available oxygen. These adaptations take time - which is why mountain climbers often spend days acclimating at different elevations before reaching the summit."
"Human Body","Nervous System","Reasonably Challenging","Why do we feel pain when we're injured?","Pain is a warning signal that tells our brain something is damaging our body.","Pain is a punishment for being careless with our bodies.","Pain exists to make us stronger by teaching us to endure discomfort.","Pain receptors in your body detect damage or potential damage and send warning signals to your brain. This important alert system protects you by making you aware of harmful situations so you can respond - by pulling your hand away from something hot or avoiding putting weight on an injured foot. Without pain, we could seriously harm ourselves without even noticing."
"Human Body","Nervous System","Reasonably Challenging","How does your brain know what you're touching without seeing it?","Special touch receptors in your skin send signals through nerves to your brain, which interprets what you're touching.","Your skin has tiny invisible eyes that see what you're touching.","Your fingers have special memory cells that remember everything they've touched before.","Your skin contains various touch receptors that detect different sensations like pressure, vibration, temperature, and texture. When you touch something, these receptors convert the physical sensation into electrical signals that travel through nerves to your brain. Your brain processes these signals and compares them to stored memories to identify what you're touching - like a computer processing input from a keyboard."
"Human Body","Nervous System","Reasonably Challenging","Why can't you tickle yourself?","Your brain predicts and cancels out sensations it knows are coming from your own actions.","Your skin recognizes your own fingers and ignores them.","The tickling part of your brain turns off when you try to tickle yourself.","When you move your own hand to tickle yourself, your brain sends commands to your muscles and simultaneously predicts the sensations that will result. Because it's expecting these sensations, it reduces their impact - similar to how you're not surprised by your reflection in a mirror because you expect to see it. This prediction system helps your brain distinguish between sensations caused by yourself versus others."
"Human Body","Nervous System","Reasonably Challenging","How does your body know to pull away from something hot before you even feel pain?","A reflex arc allows your spinal cord to signal muscles to move away before the pain signal reaches your brain.","Your fingers have special heat detectors that work faster than pain receptors.","Your muscles are afraid of heat and automatically jump away.","When you touch something hot, temperature receptors send an urgent signal to your spinal cord, which immediately sends a command to your muscles to pull away - all before the pain signal has time to reach your brain and be processed. This reflex arc is a shortcut that protects you from severe burns by responding in a fraction of a second, much faster than conscious thought."
"Human Body","Nervous System","Reasonably Challenging","Why do we get 'brain freeze' when eating ice cream too quickly?","Cold in your mouth triggers nerves that also connect to your head, causing referred pain.","Your brain actually freezes temporarily when you eat cold foods.","Ice cream contains chemicals that cause brief headaches as a warning.","When you eat something very cold, it chills the roof of your mouth and back of your throat. This activates temperature-sensitive nerves that are branches of the same nerves that sense pain in your forehead and scalp. Your brain gets confused about where the cold sensation is coming from and incorrectly interprets it as pain in your head - it's called 'referred pain' and happens in other parts of your body too."
"Human Body","Nervous System","Very Challenging","How does your brain create and store memories?","Different types of memories form when connections between brain cells strengthen through repeated use.","Memories are stored in tiny filing cabinets inside brain cells.","Your brain takes internal photographs that get printed onto special memory tissue.","When you experience something, networks of neurons (brain cells) activate together. When these neurons fire together repeatedly, the connections between them strengthen - it's like creating a path through grass by walking the same way many times. Different brain regions handle different memory types: the hippocampus processes new memories before they're stored in the cortex for long-term storage, while procedural memories like riding a bike involve the cerebellum and motor cortex."
"Human Body","Nervous System","Very Challenging","How do neurons communicate with each other using electrical and chemical signals?","Neurons send electrical signals down their length, then release chemicals that cross the gap to the next neuron.","Neurons flash like tiny lightbulbs to signal nearby cells.","Neurons physically touch each other to pass information directly.","Neurons are separated by tiny gaps called synapses. When an electrical signal reaches the end of a neuron, it triggers the release of chemical messengers called neurotransmitters that float across the gap and attach to receptors on the next neuron. This attachment either encourages or discourages the receiving neuron from firing its own electrical signal - similar to a relay race where a runner (electrical signal) hands off a baton (neurotransmitter) to the next runner."
"Human Body","Nervous System","Very Challenging","Why does the brain have different specialized regions rather than working as one uniform organ?","Different brain regions evolved to specialize in processing specific types of information more efficiently.","The brain is divided to prevent a single injury from affecting all functions.","Different brain regions take turns being active to prevent fatigue.","The brain developed specialized regions over millions of years of evolution because specialization improves efficiency - similar to how a factory works better when different workers focus on specific tasks. Your occipital lobe processes vision, temporal lobe handles hearing and language, frontal lobe manages decision-making and personality, while the cerebellum coordinates movement. This specialization allows complex processing to happen simultaneously and more effectively than if all regions performed all functions."
"Human Body","Nervous System","Very Challenging","How does your nervous system control both voluntary movements like writing and involuntary functions like heartbeat?","Your somatic nervous system controls voluntary movements while your autonomic nervous system manages involuntary functions.","Your left brain controls voluntary movements while your right brain handles involuntary functions.","Your brain handles voluntary functions while your spinal cord controls all involuntary processes.","Your nervous system has two main divisions: the somatic system that controls voluntary movements through direct connections between your brain and skeletal muscles, and the autonomic system that regulates involuntary processes through the sympathetic (activating) and parasympathetic (calming) branches. This dual system allows you to consciously control some actions while vital functions like heart rate, digestion, and breathing continue automatically - even when you're asleep or focused on other tasks."
"Human Body","Nervous System","Very Challenging","How do sensory illusions reveal the way our brain processes information?","Sensory illusions occur when our brain misinterprets or fills in missing information based on expectations and past experiences.","Sensory illusions happen when our brain gets tired and makes mistakes.","Illusions only affect people with damaged sensory organs.","Your brain doesn't passively receive sensory information; it actively interprets and sometimes reconstructs it based on context, expectations, and previous experiences. Optical illusions occur when your visual system makes assumptions - like assuming light comes from above or that parallel lines remain parallel. These illusions reveal that what we perceive isn't a direct recording of reality but a construction created by our brain - similar to how a computer program might make predictions to fill in missing data."