"topic","subtopic","difficulty","question","correct_answer","wrong_answer1","wrong_answer2","explanation"
"Human Body","Skeletal System","Reasonably Challenging","Why are bones important for our body?","Bones give our body shape and support.","Bones make us feel hot.","Bones help us breathe.","Bones are like the frame of a house that supports everything; they don't affect temperature or breathing."
"Human Body","Skeletal System","Reasonably Challenging","How do bones protect our organs?","They act as a shield around important parts like the brain and heart.","They cool the organs by touching them.","They help organs produce food.","Bones form protective barriers such as the skull and rib cage, while the other options do not reflect their true role."
"Human Body","Skeletal System","Reasonably Challenging","What happens when a bone breaks?","It can be healed by the body with proper care.","It turns into a muscle.","It disappears and never grows back.","When a bone breaks, it can mend over time with care, unlike turning into a muscle or vanishing completely."
"Human Body","Skeletal System","Reasonably Challenging","Why do you think bones need to be strong?","Strong bones help us move and do activities safely.","Strong bones make us run faster without muscles.","Strong bones are used for storing water.","Bones provide support and help us move; they do not replace muscles or serve as water storage."
"Human Body","Skeletal System","Reasonably Challenging","How can you help keep your bones healthy?","By eating foods rich in calcium and exercising.","By sleeping all day and not moving.","By drinking soda every day.","Eating calcium-rich foods and staying active helps bones grow strong, unlike a sedentary lifestyle or soda consumption."
"Human Body","Skeletal System","Very Challenging","How does the skeletal system work with muscles to enable movement?","Bones provide the framework and muscles pull on them to create movement.","Bones push the muscles to move on their own.","Muscles hold bones in place so they never move.","Bones and muscles work together where muscles pull on bones to move the body; bones don't push muscles, and muscles don't just hold bones still."
"Human Body","Skeletal System","Very Challenging","Why is the structure of a bone important for its strength?","Its shape and internal design help distribute weight and resist stress.","Its shape changes the color of the bone.","Its internal design is made of soft material that bends easily.","The structure of bones is designed to handle stress and weight, not to change color or be soft."
"Human Body","Skeletal System","Very Challenging","In what way do bones grow stronger over time?","Bones become denser when they are regularly used and exercised.","Bones get stronger by being touched often.","Bones grow stronger if you drink extra water.","Regular exercise makes bones denser and stronger, unlike simple touching or drinking water."
"Human Body","Skeletal System","Very Challenging","How do joints help in the movement of the skeletal system?","Joints connect bones and allow them to move smoothly.","Joints make bones break faster.","Joints are like extra bones that replace old ones.","Joints act like hinges connecting bones, enabling smooth movement; they do not cause breaks or replace bones."
"Human Body","Skeletal System","Very Challenging","Why is it important for bones to work with other systems in our body?","They support and protect organs and work with muscles to enable movement.","They help the skin change colors.","They make the body taste sweet.","Bones support and protect vital organs and help with movement, not for changing skin color or taste."
"Human Body","Muscular System","Reasonably Challenging","How do muscles help us move?","Muscles contract to pull our bones and create movement.","Muscles push our bones to move.","Muscles fill our body with energy by themselves.","Muscles work by contracting (shortening) to pull on bones, which creates movement; they do not push bones or independently generate energy."
"Human Body","Muscular System","Reasonably Challenging","Why do muscles need exercise?","Exercise helps muscles stay strong and flexible.","Exercise makes muscles get tired and weak.","Exercise only makes the skin sweat without affecting muscles.","Regular exercise strengthens muscles and keeps them flexible, unlike causing weakness or just sweating."
"Human Body","Muscular System","Reasonably Challenging","How does a muscle contraction work?","It happens when a muscle shortens to pull a bone.","It happens when a muscle lengthens suddenly.","It happens when muscles freeze and then snap.","Muscle contraction involves the muscle shortening to move a bone, rather than lengthening or freezing."
"Human Body","Muscular System","Reasonably Challenging","Why is it important to stretch before physical activities?","Stretching helps prepare muscles and prevent injuries.","Stretching makes muscles shorter and weaker.","Stretching only helps the skin become more flexible.","Stretching warms up muscles and makes them less prone to injury, not causing weakness or only affecting the skin."
"Human Body","Muscular System","Reasonably Challenging","How do muscles get the energy they need to work?","They get energy from the food we eat.","They get energy from sunlight.","They get energy from drinking only water.","Muscles use energy derived from food, which is converted into fuel, unlike sunlight or water which do not provide direct energy."
"Human Body","Muscular System","Very Challenging","How do different types of muscles (like smooth, skeletal, and cardiac) work in our body?","Each muscle type has a unique role, with skeletal muscles moving bones, cardiac muscles pumping blood, and smooth muscles controlling internal organs.","All muscles work the same way regardless of their type.","Only skeletal muscles are important, while others do nothing.","Different muscle types have specialized functions in the body, unlike the oversimplified idea that they all work the same or some are unimportant."
"Human Body","Muscular System","Very Challenging","Why do muscles sometimes feel sore after exercise?","Soreness is caused by tiny muscle fibers getting strained and then healing.","Soreness happens because muscles lose their color.","Soreness is due to muscles freezing during exercise.","Muscle soreness results from microscopic strains that occur during exercise, not from color changes or freezing."
"Human Body","Muscular System","Very Challenging","How does muscle fatigue occur?","Fatigue happens when muscles run low on energy and need a rest.","Fatigue occurs because muscles become too hot.","Fatigue happens when muscles stop getting blood.","Muscle fatigue is about energy depletion from continuous use, not from overheating or a complete lack of blood supply."
"Human Body","Muscular System","Very Challenging","How does regular exercise affect muscle growth?","It helps build stronger muscle fibers over time.","It makes muscles shrink and disappear.","It only affects the bones, not the muscles.","Regular exercise stimulates muscle growth and strengthens fibers, unlike the idea that it would make them shrink or only affect bones."
"Human Body","Muscular System","Very Challenging","How do muscles communicate with the brain to control movement?","Nerves send signals from the brain to the muscles to contract.","Muscles send signals to the brain to move by themselves.","The brain uses magic to make muscles move without signals.","The brain and muscles communicate via nerves that send signals, not by muscles acting independently or magic."
"Human Body","Circulatory System","Reasonably Challenging","Why is the heart important in the circulatory system?","The heart pumps blood to deliver oxygen and nutrients.","The heart stores food for energy.","The heart makes the blood look red.","The heart's main function is to pump blood throughout the body, not to store food or change blood color."
"Human Body","Circulatory System","Reasonably Challenging","How does blood travel throughout the body?","Blood moves through a network of vessels like highways.","Blood jumps between cells on its own.","Blood travels through holes in the bones.","Blood flows through arteries, veins, and capillaries that work like highways, unlike the incorrect ideas."
"Human Body","Circulatory System","Reasonably Challenging","Why do you think oxygen is carried by the blood?","Oxygen is needed by cells to produce energy.","Oxygen makes the blood blue.","Oxygen is carried by blood to cool the body.","Cells require oxygen to make energy, much like a car needs fuel, rather than affecting the blood's color or temperature."
"Human Body","Circulatory System","Reasonably Challenging","How does exercise affect the circulatory system?","Exercise increases heart rate and helps blood circulate faster.","Exercise makes the blood stop moving.","Exercise only affects the muscles, not the heart.","When we exercise, the heart beats faster to pump blood more quickly, unlike the ideas that suggest blood stops or only muscles are affected."
"Human Body","Circulatory System","Reasonably Challenging","Why is it important to have a healthy circulatory system?","A healthy system delivers oxygen and nutrients to all parts of the body.","A healthy system makes the blood taste sweet.","A healthy system keeps the body cold.","A well-functioning circulatory system ensures that all body parts receive oxygen and nutrients, not by altering taste or temperature."
"Human Body","Circulatory System","Very Challenging","How do the structure and function of arteries and veins differ?","Arteries carry blood away from the heart and have thicker walls, while veins bring blood back with valves to prevent backflow.","Arteries bring blood back to the heart and have thin walls.","Veins carry blood away from the heart with strong muscles.","Arteries and veins have distinct roles in circulation, with arteries sending blood out and veins returning it, unlike the mixed-up ideas in the wrong answers."
"Human Body","Circulatory System","Very Challenging","Why does the heart beat faster during physical activity?","Because the body needs more oxygen, so the heart pumps faster to deliver it.","Because the heart is trying to run away.","Because the blood gets too heavy.","During exercise, the heart beats faster to meet the increased oxygen demand, not because of any unrelated reasons like running away or heavy blood."
"Human Body","Circulatory System","Very Challenging","How do capillaries help in the exchange of materials in the body?","Capillaries are tiny vessels where oxygen and nutrients pass into cells.","Capillaries store extra blood for emergencies.","Capillaries are channels that remove bones from the body.","Capillaries allow the exchange of oxygen and nutrients between blood and cells, unlike the incorrect ideas of storing blood or removing bones."
"Human Body","Circulatory System","Very Challenging","What role does blood pressure play in our circulatory system?","Blood pressure helps push blood through our vessels.","Blood pressure causes the blood to turn into bones.","Blood pressure makes blood flow backwards.","Blood pressure is the force that propels blood through vessels, not something that forms bones or reverses flow."
"Human Body","Circulatory System","Very Challenging","How can a healthy diet affect the circulatory system?","A healthy diet can improve blood flow and strengthen the heart.","A healthy diet makes the blood look brighter.","A healthy diet stops the heart from beating too fast.","A balanced diet supports good circulation and heart health, not by altering blood color or interfering with heart rate."
"Human Body","Digestive System","Reasonably Challenging","Why do we need the digestive system?","The digestive system helps break down food to give us energy.","The digestive system makes our food taste sweeter.","The digestive system creates food from air.","The digestive system turns food into energy, rather than changing its taste or creating food."
"Human Body","Digestive System","Reasonably Challenging","How does food travel through our digestive system?","Food moves from the mouth to the stomach and then through the intestines.","Food jumps from the stomach directly to the brain.","Food stays in one place until it magically disappears.","Food follows a clear path from the mouth, to the stomach, and then through the intestines, unlike the incorrect ideas."
"Human Body","Digestive System","Reasonably Challenging","Why is the stomach important in digestion?","The stomach mixes and breaks down food with acids and enzymes.","The stomach stores water for the body.","The stomach makes food colorful.","The stomach uses acids and enzymes to digest food, not to store water or change its color."
"Human Body","Digestive System","Reasonably Challenging","How do the intestines help us absorb nutrients?","They have tiny structures that take in vitamins and minerals from food.","They push food out without absorbing anything.","They turn food into muscles.","The intestines absorb nutrients through tiny structures called villi, unlike the incorrect options."
"Human Body","Digestive System","Reasonably Challenging","How can eating healthy foods benefit our digestive system?","Healthy foods provide good nutrients and help keep the digestive system working well.","Healthy foods make the digestive system stop working.","Healthy foods only fill the stomach but do not help digestion.","A healthy diet supports proper digestion by giving the body the nutrients it needs, unlike ideas that suggest harm or no benefit."
"Human Body","Digestive System","Very Challenging","How do enzymes and acids work together in the stomach?","Enzymes break down food while acids help dissolve it for better digestion.","Enzymes and acids only change the color of food.","Enzymes stop acids from working.","Enzymes and acids work in tandem to break down food, rather than just changing its color or interfering with each other."
"Human Body","Digestive System","Very Challenging","Why is the lining of the intestines important for digestion?","It contains tiny hair-like structures that absorb nutrients efficiently.","It makes the intestines taste sweet.","It is where food is stored for a long time.","The lining of the intestines is covered with villi that absorb nutrients, not for taste or long-term storage."
"Human Body","Digestive System","Very Challenging","How does the digestive system work with other body systems?","It provides energy and nutrients that other systems need to function.","It sends food directly to the muscles without processing.","It only works when we are sleeping.","The digestive system supports the entire body by supplying energy and nutrients, unlike the ideas of bypassing processing or working only during sleep."
"Human Body","Digestive System","Very Challenging","How does the liver assist in digestion?","The liver produces bile to help break down fats.","The liver digests food completely on its own.","The liver stores all the food we eat.","The liver helps digest fats by producing bile, not by digesting food on its own or storing it."
"Human Body","Digestive System","Very Challenging","Why is it important to chew food well?","Chewing breaks food into smaller pieces, making it easier to digest.","Chewing changes the color of food.","Chewing makes food stick to your teeth permanently.","Chewing helps break food into smaller pieces for digestion, unlike changing its color or making it stick to teeth."
"Human Body","Nervous System","Reasonably Challenging","Why is the brain important in the nervous system?","The brain controls our thoughts, movements, and feelings.","The brain only controls the muscles.","The brain makes our body parts colorful.","The brain is the control center for many functions, not just for muscles or changing colors."
"Human Body","Nervous System","Reasonably Challenging","How do nerves help our body?","Nerves send signals between the brain and different parts of the body.","Nerves carry food from the stomach to the brain.","Nerves are only used for feeling pain.","Nerves act as messengers, carrying signals from the brain to the body, not moving food or only signaling pain."
"Human Body","Nervous System","Reasonably Challenging","How does the nervous system help us react to danger?","It quickly sends signals to help us move away or respond.","It makes us fall asleep instantly.","It tells our muscles to stop working permanently.","The nervous system sends fast signals in dangerous situations to help us react, rather than causing sleep or stopping muscle function."
"Human Body","Nervous System","Reasonably Challenging","Why is it important to protect your head?","Protecting your head helps keep the brain safe from injury.","Protecting your head makes you run faster.","Protecting your head helps your eyes see better.","Keeping your head safe, for example by wearing a helmet, protects your brain from injury, not your speed or eyesight."
"Human Body","Nervous System","Reasonably Challenging","How do the senses work with the nervous system?","Senses send information to the brain so it can understand the world.","Senses work independently without the brain.","Senses are used only for fun, not for learning.","Our senses send important information to the brain, helping us learn and understand our surroundings, unlike the ideas of them working alone or just for fun."
"Human Body","Nervous System","Very Challenging","How do neurons communicate with each other in the brain?","Neurons send electrical and chemical signals to communicate.","Neurons talk with each other using sound waves.","Neurons only use chemical signals and never electrical ones.","Neurons use both electrical impulses and chemical signals to send messages, unlike the incorrect ideas of sound or a single method."
"Human Body","Nervous System","Very Challenging","Why is the spinal cord essential for the nervous system?","It acts as a major pathway for signals between the brain and the body.","It stores memories like a book.","It produces energy for the muscles.","The spinal cord is like a highway for signals between the brain and the body, not for storing memories or producing energy."
"Human Body","Nervous System","Very Challenging","How does the brain process information from our senses?","The brain receives signals from the senses and interprets them to make decisions.","The brain reads signals as words on a page.","The brain sends signals to the senses to create pictures.","The brain processes sensory information by interpreting signals, rather than reading them like text or creating pictures directly."
"Human Body","Nervous System","Very Challenging","How do reflex actions work in the nervous system?","Reflex actions are quick responses that happen without thinking.","Reflex actions occur after a long pause for thought.","Reflex actions are controlled by the stomach.","Reflexes are fast and automatic responses that protect us without conscious thought, unlike delayed or misattributed actions."
"Human Body","Nervous System","Very Challenging","How can learning and practicing new skills change the brain?","It helps build new connections between neurons.","It makes the brain shrink to fit more ideas.","It changes the brain into a muscle.","Learning new skills builds and strengthens neural connections, rather than shrinking the brain or turning it into a muscle."