"topic","subtopic","difficulty","question","correct_answer","wrong_answer1","wrong_answer2","explanation"
"Human Body","Skeletal System","Reasonably Challenging","Why does our skeleton need both hard and flexible parts?","Our skeleton needs flexibility to allow movement while providing structure and protection for organs.","Our skeleton is only hard and has no flexible parts at all.","The flexible parts of our skeleton are there to help us grow taller.","Our skeleton has hard bones for protection and structure, but also flexible cartilage and joints that allow us to move. Without these flexible connections, we couldn't bend, twist, or move around - imagine trying to run with completely rigid legs!"
"Human Body","Skeletal System","Reasonably Challenging","How does the skull protect our brain?","The skull forms a hard protective case around the brain with no moving parts except the jaw.","The skull has many movable parts that expand when our brain grows.","The skull is soft like a sponge to absorb impacts to the head.","The skull is made of several fused bones creating a solid protective case around the brain. Unlike other joints in the body, most skull bones don't move against each other (except the jaw), which provides maximum protection for this vital organ while still allowing us to eat and speak."
"Human Body","Skeletal System","Reasonably Challenging","What happens to bones as we grow from babies to adults?","Bones grow longer and stronger, and some fuse together as we mature.","Bones stay the same size but just get harder as we grow.","We grow extra bones as we get older to support our larger bodies.","When we're born, we have about 300 bones, but adults have only 206 because some bones fuse together as we grow. Our bones also get longer, denser, and stronger throughout childhood and teenage years to support our growing bodies and protect our organs better."
"Human Body","Skeletal System","Reasonably Challenging","Why do doctors use X-rays to check for broken bones?","X-rays can pass through soft tissue but not through dense bone, creating a clear image of the skeleton.","X-rays make bones glow in the dark so doctors can see them.","X-rays can melt broken bones back together when applied correctly.","X-rays are a type of invisible light that passes easily through skin and muscles but gets blocked by dense bone, creating a shadow image on special film. This allows doctors to see if bones are broken without having to cut the skin open, making diagnosis much safer and less painful."
"Human Body","Skeletal System","Reasonably Challenging","How do our bones help us besides providing structure?","Bones produce blood cells, store minerals, and help our bodies move by working with muscles.","Bones only serve as a framework to hang our organs on.","Bones are mainly used for protection and have no other functions.","Besides providing structure, bones contain bone marrow that produces blood cells to carry oxygen throughout our body. They also store important minerals like calcium and phosphorus that our body needs, and work with muscles to create movement - they're much more than just a human framework!"
"Human Body","Skeletal System","Very Challenging","Why do young children's bones heal faster than adult bones?","Children's bones contain more growth cells and have better blood supply, allowing for faster healing.","Children's bones contain special healing crystals that adults don't have.","Children's bones are softer, so they don't actually break completely and are easier to fix.","Children's bones have special areas called growth plates that are full of actively dividing cells, along with a rich blood supply that delivers healing nutrients quickly. Adults have completed their bone growth, so they have fewer of these active repair cells and less blood flow to bones, making healing generally slower."
"Human Body","Skeletal System","Very Challenging","How does the spine allow us to stand upright while still being flexible?","The spine has a special S-curve and stacked vertebrae with discs between them that provide both stability and flexibility.","The spine is a single rigid bone that keeps us perfectly straight at all times.","The spine is mostly made of muscle that contracts to keep us upright.","The human spine has a special S-shaped curve that helps distribute our weight efficiently for upright walking. It consists of 33 stacked vertebrae (small bones) with shock-absorbing discs between them, allowing us to bend and twist while still supporting our body weight and protecting the spinal cord."
"Human Body","Skeletal System","Very Challenging","Why do astronauts lose bone density when living in space?","In zero gravity, bones don't need to support body weight, so they begin to weaken and lose minerals.","Space radiation directly damages bone cells causing them to shrink.","Astronauts' bodies convert bone to muscle to help them maneuver in space.","Our bones stay strong through regular weight-bearing activities like walking and standing. In the weightlessness of space, bones aren't stressed by gravity, so the body starts to break down bone tissue and release its minerals into the bloodstream - it's like how muscles weaken when not used. This is why astronauts must exercise regularly in space."
"Human Body","Skeletal System","Very Challenging","How does the connection between bones at a joint allow for different types of movement?","Different joint shapes allow different movements - ball-and-socket joints enable rotation while hinge joints only permit bending and straightening.","All joints in the body work exactly the same way and allow the same types of movement.","Joints are just spaces between bones with no special structures.","Joints come in different shapes that determine how we can move. Ball-and-socket joints like in your shoulder let you rotate your arm in many directions, while hinge joints like in your elbow only let you bend and straighten. The shape of the connecting bone surfaces, along with supporting ligaments, determines exactly what movements are possible at each joint."
"Human Body","Skeletal System","Very Challenging","What makes bones strong yet lightweight?","Bones have a hard outer layer and a honeycomb-like interior structure that provides strength without excessive weight.","Bones are completely solid throughout like rocks.","Bones are hollow tubes with nothing inside them.","Bones have an ingenious design with a dense, hard outer layer for strength and a spongy interior with a honeycomb pattern. This structure works similarly to how engineers design bridges and buildings - providing maximum strength while minimizing weight, which allows us to move efficiently while still protecting our organs."
"Human Body","Digestive System","Reasonably Challenging","Why do we need to chew our food before swallowing?","Chewing breaks food into smaller pieces and mixes it with saliva to begin digestion.","Chewing is just for tasting food and isn't necessary for digestion.","We chew food to make it hot enough for our stomach to process.","Chewing is the first step of digestion where our teeth break food into smaller pieces, increasing the surface area for digestive enzymes to work on. Our saliva contains special chemicals that begin breaking down starches while we chew, so proper chewing gives our body a head start on digestion."
"Human Body","Digestive System","Reasonably Challenging","How does your stomach know when you're hungry?","Your stomach and brain communicate through hormones and nerve signals when your body needs energy.","Your stomach has a built-in clock that makes you hungry at specific times.","Your stomach gets smaller when empty, which causes hunger pangs.","When your stomach is empty and your body needs energy, it releases a hormone called ghrelin that signals your brain to feel hungry. The brain and digestive system constantly communicate through a network of nerves and chemical messengers to help regulate when and how much you eat."
"Human Body","Digestive System","Reasonably Challenging","Why can't we survive by eating just one type of food, like only bananas or only chicken?","Different foods contain different nutrients, and our bodies need a variety of nutrients to function properly.","We get bored of eating the same food, which makes us physically sick.","Our taste buds need variety or they stop working after a week.","Our bodies need many different nutrients to stay healthy - proteins to build muscles, carbohydrates for energy, fats for brain function, plus vitamins and minerals for various processes. No single food contains all these in the right amounts, which is why a varied diet is essential for proper growth and health."
"Human Body","Digestive System","Reasonably Challenging","What happens to food after it leaves your stomach?","Food enters the small intestine where nutrients are absorbed into the bloodstream.","Food goes directly into the bloodstream from the stomach.","Food travels to the heart where it's pumped to different body parts.","After your stomach breaks down food, it moves into the small intestine - a long, winding tube where most nutrients are absorbed through tiny finger-like projections called villi. These nutrients enter your bloodstream to be carried throughout your body, while indigestible parts continue moving toward the large intestine."
"Human Body","Digestive System","Reasonably Challenging","Why does your mouth water when you smell delicious food?","Your body automatically prepares for digestion by releasing saliva when it detects food is coming.","Your taste buds leak water when they get excited about food.","Your brain sends extra water to your mouth to help you talk about the food.","When you smell food, your brain receives signals that food might be coming and triggers your salivary glands to produce saliva. This is a helpful automatic response because saliva contains enzymes that start breaking down food and also moistens food to make it easier to swallow - your body is getting ready to digest!"
"Human Body","Digestive System","Very Challenging","How does your body know which nutrients to absorb and which to let pass through?","The lining of your intestines has specialized cells that only transport specific nutrients into the bloodstream.","Your pancreas sends color-coded signals to mark good and bad nutrients.","Your stomach pre-sorts all nutrients before they reach the intestines.","The intestinal lining contains specialized cells with specific transporters that work like security guards, only allowing certain molecules to pass through. For example, amino acid transporters only pick up protein building blocks, while glucose transporters only accept certain sugars. This selective absorption ensures your body takes in what it needs while letting other substances continue through your digestive tract."
"Human Body","Digestive System","Very Challenging","Why does the small intestine have a much larger surface area than you might expect from its length?","The small intestine has folds, villi, and microvilli that dramatically increase its surface area for better nutrient absorption.","The small intestine stretches out to become much longer during digestion.","The small intestine contains numerous tiny balloons that inflate to increase size.","Although the small intestine is about 20 feet long, its inner surface is covered with circular folds, which are covered with tiny finger-like projections called villi, which are in turn covered with even tinier microvilli. This creates a surface area equivalent to a tennis court, allowing your body to absorb nutrients very efficiently - like having thousands of tiny doorways instead of just a few large ones."
"Human Body","Digestive System","Very Challenging","How does your liver help with digestion?","The liver produces bile that helps break down fats and also processes nutrients after they're absorbed.","The liver grinds up food that the teeth missed during chewing.","The liver adds flavors to food so we can taste different things.","The liver produces a substance called bile, which gets stored in your gallbladder and released into the small intestine to help break down fats - it works like dish soap breaking up greasy food. Additionally, the liver processes nutrients after they're absorbed, storing some for later use and converting others into forms your body can use right away."
"Human Body","Digestive System","Very Challenging","Why don't the strong acids in your stomach digest the stomach itself?","Stomach cells produce a thick protective mucus layer and continuously replace themselves.","The stomach is made of special acid-proof tissue unlike any other in the body.","The acids in the stomach only activate when they touch food.","Your stomach produces strong acid that could dissolve metal, but it protects itself in two clever ways: stomach cells secrete a thick layer of alkaline mucus that neutralizes acid near the stomach wall, and the stomach lining completely replaces itself every 3-4 days. Without these protections, the stomach would indeed begin to digest itself, which sometimes happens in ulcers."
"Human Body","Digestive System","Very Challenging","How does your body use the food you eat to create energy?","Cells break down food molecules through a process called cellular respiration, which converts them to energy.","Food is burned inside special chambers in the heart to release heat energy.","Food directly becomes energy without any conversion process.","After digestion breaks food into molecules like glucose, these molecules enter your cells where specialized structures called mitochondria break them down through a multi-step process called cellular respiration. This process combines these molecules with oxygen to release their stored energy and create ATP - the energy currency your cells use to power everything from muscle movement to thinking."
"Human Body","Circulatory System","Reasonably Challenging","Why does your heart beat faster when you exercise?","Your heart beats faster to deliver more oxygen to your working muscles.","Your heart gets scared when you move quickly, causing it to beat faster.","Your heart beats faster to wake up your brain during exercise.","When you exercise, your muscles work harder and use more oxygen and nutrients. Your heart responds by pumping faster to deliver more oxygen-rich blood to those working muscles and to remove waste products like carbon dioxide more quickly - it's like a delivery service speeding up when there are more packages to deliver."
"Human Body","Circulatory System","Reasonably Challenging","How does blood help keep your body temperature stable?","Blood vessels near your skin can expand or contract to release or retain heat.","Blood changes color based on your body temperature.","Blood becomes thicker when you're cold and thinner when you're hot.","Your blood vessels work like the thermostat in your home. When you're hot, blood vessels near your skin expand, bringing warm blood closer to the surface where heat can escape (making your skin look red). When you're cold, these same vessels narrow, keeping warm blood deeper inside to preserve heat - this clever system helps maintain your core temperature."
"Human Body","Circulatory System","Reasonably Challenging","What makes blood appear red?","The hemoglobin in red blood cells contains iron that gives blood its red color.","Blood contains tiny red berries that are crushed in the heart.","Blood is filled with red dye produced by the liver.","Blood looks red because of hemoglobin, a special protein in red blood cells that contains iron. This iron-containing protein is excellent at carrying oxygen, which is its main job, and the iron gives it a red color - brighter red when carrying oxygen and darker red when it's not, much like how iron turns reddish when it rusts."
"Human Body","Circulatory System","Reasonably Challenging","How does your heart make sure blood flows in only one direction?","Your heart has one-way valves that prevent blood from flowing backward.","Your blood knows which way to flow because it's magnetically attracted to your lungs.","Your brain sends electrical signals telling blood which way to move.","Your heart has special one-way valves between its chambers that work like swinging doors that only open in one direction. When the heart contracts, blood pushes the valves open to move forward, but if it tries to flow backward, the valves snap shut - preventing backflow and ensuring efficient circulation through your body."
"Human Body","Circulatory System","Reasonably Challenging","Why do doctors listen to your heartbeat with a stethoscope?","Doctors can hear the sound of heart valves closing and detect problems with heart rhythm or valve function.","Doctors are checking if your heart is speaking a language they understand.","The stethoscope measures how much blood your heart pumps with each beat.","The lub-dub sound of your heartbeat comes from heart valves closing as blood moves through your heart's chambers. By listening with a stethoscope, doctors can tell if these valves are closing properly and if your heart is beating in a healthy rhythm - unusual sounds might indicate that blood isn't flowing correctly or that a valve might be leaking."
"Human Body","Circulatory System","Very Challenging","How does oxygen move from your lungs into your bloodstream?","Oxygen diffuses across the thin walls of air sacs and blood vessels where the concentration is higher in the lungs than in the blood.","Tiny pumps in your lungs actively push oxygen molecules into your blood.","Your blood cells leave your vessels to collect oxygen and then return.","In your lungs, air fills tiny sacs called alveoli which are surrounded by equally tiny blood vessels. The walls of both are incredibly thin - just one cell thick. Oxygen naturally moves from areas of high concentration (the air sacs) to areas of low concentration (the blood) through a process called diffusion, similar to how the scent of cookies spreads through a house."
"Human Body","Circulatory System","Very Challenging","Why do red blood cells lack a nucleus unlike most other cells in your body?","Without a nucleus, red blood cells have more space to carry oxygen and can squeeze through tiny blood vessels.","Red blood cells donate their nuclei to white blood cells to help fight infections.","Red blood cells are too busy carrying oxygen to maintain a nucleus.","Most cells need a nucleus to store DNA and direct cell activities, but mature red blood cells eject their nucleus during development. This creates more space for hemoglobin (the oxygen-carrying protein) and allows the cells to adopt a flexible biconcave shape that can squeeze through the narrowest capillaries - it's like removing seats from a delivery van to fit more packages."
"Human Body","Circulatory System","Very Challenging","How does your body create new blood cells to replace old ones?","Bone marrow contains stem cells that can develop into different types of blood cells.","Your spleen contains templates that stamp out new blood cells.","Your liver filters old blood cells and recycles them into new ones.","Inside your bones is a spongy tissue called bone marrow that contains special cells called stem cells. These stem cells can develop into any type of blood cell needed - red blood cells to carry oxygen, white blood cells to fight infection, or platelets to help with clotting. Your body produces millions of new blood cells every second to replace those that have worn out."
"Human Body","Circulatory System","Very Challenging","Why do cuts stop bleeding after a while?","Platelets form a plug while proteins in plasma create a fibrin mesh that hardens into a scab.","Blood automatically solidifies when it touches air.","White blood cells build walls around wounds to keep blood inside.","When you get a cut, tiny cell fragments called platelets rush to the scene and stick together to form a plug. At the same time, plasma proteins trigger a chain reaction called the coagulation cascade, creating fibrin threads that form a mesh across the wound. This platelet-fibrin combination hardens into a scab, stopping blood loss while giving the damaged tissue time to heal underneath."
"Human Body","Circulatory System","Very Challenging","How does blood pressure help move blood through your body?","The heart creates pressure by contracting, pushing blood through arteries that maintain this pressure to deliver blood throughout the body.","Static electricity in the blood pulls it through your vessels.","Your lungs inflate to create suction that pulls blood through your body.","Your heart creates pressure by forcefully contracting and pushing blood into arteries, which have elastic walls that maintain this pressure. This is similar to how squeezing a water balloon creates pressure that pushes water out. Blood flows from high-pressure arteries through progressively smaller vessels to low-pressure veins, like water flowing downhill - the pressure difference is what keeps blood moving through your entire circulatory system."
"Human Body","Respiratory System","Reasonably Challenging","Why do we breathe faster when we exercise?","We breathe faster to bring in more oxygen and remove more carbon dioxide when our muscles are working harder.","We breathe faster because our lungs get excited during exercise.","We breathe faster to cool down our body temperature.","During exercise, your muscles work harder and use more oxygen while producing more carbon dioxide as waste. Your brain detects this change and signals your breathing to speed up, bringing in extra oxygen for your active muscles and removing the extra carbon dioxide they're producing - like turning up a fan when a room gets stuffy."
"Human Body","Respiratory System","Reasonably Challenging","How does your nose help protect your lungs?","Your nose filters, warms, and moistens air before it reaches your lungs.","Your nose tests air for poison and sounds an alarm if it detects danger.","Your nose counts how many breaths you take to make sure you're getting enough.","Your nose is like a security system for your lungs - it's lined with tiny hairs and mucus that trap dust and germs, preventing them from reaching your lungs. It also warms cold air and adds moisture to dry air, preparing it perfectly for your sensitive lung tissue which works best with clean, warm, humid air."
"Human Body","Respiratory System","Reasonably Challenging","What makes us cough when something irritates our throat?","Coughing is a protective reflex that forcefully expels irritants from our airway.","Coughing is our lungs' way of exercising to stay strong.","Coughing happens when our voice gets tired of talking normally.","Your respiratory system has special sensors that detect irritants like dust or smoke. When these sensors are triggered, they send an urgent message to your brain, which responds by commanding a powerful contraction of breathing muscles to expel air forcefully - creating a cough that blasts out the unwanted particle like a natural defense system."
"Human Body","Respiratory System","Reasonably Challenging","Why can't humans breathe underwater like fish?","Humans have lungs that can extract oxygen from air but not from water, while fish have gills specially designed for underwater breathing.","Humans' lungs are too big to process water efficiently.","Human lungs are allergic to water and will reject it.","Humans have lungs designed to extract oxygen from air, but they can't separate oxygen from water. Fish have specialized organs called gills with extremely thin membranes and a large surface area that can extract dissolved oxygen directly from water. It's like having the wrong tool for the job - just as you can't use a vacuum cleaner to pick up water, our lungs can't process water for breathing."
"Human Body","Respiratory System","Reasonably Challenging","What causes hiccups and why can't we control them?","Hiccups happen when your diaphragm spasms involuntarily, usually due to irritation of the nerves controlling it.","Hiccups are your lungs practicing for emergencies.","Hiccups happen when your lungs get bored and want attention.","Hiccups occur when your diaphragm (the main muscle used for breathing) suddenly contracts involuntarily. This causes you to quickly suck in air, but your vocal cords snap shut, creating the hic sound. Because they're caused by nerve irritation and happen automatically, we can't directly control them - similar to how you can't stop your knee from jerking when the doctor taps it with a hammer."
"Human Body","Respiratory System","Very Challenging","How do the diaphragm and intercostal muscles work together during breathing?","The diaphragm flattens and intercostal muscles lift the ribs to increase chest volume, creating negative pressure that draws air in.","The diaphragm and intercostals take turns breathing so each can rest.","These muscles squeeze the lungs directly like wringing out a sponge.","Breathing in is actually caused by creating negative pressure, not pulling air in directly. When your diaphragm contracts and moves downward while intercostal muscles lift your ribs outward, they increase your chest cavity's volume. This creates slightly negative pressure inside your chest compared to outside, and air naturally flows from higher pressure (outside) to lower pressure (your lungs) - similar to how a syringe fills when you pull back the plunger."
